{
  "$schema": "http://json-schema.org/draft-07/schema#",
  "$id": "https://afi-protocol.org/schemas/scored-signal-evidence/v1/scored-signal-evidence.schema.json",
  "title": "AFI ScoredSignalEvidence v1 (MONGO-CONTRACT — canonical scored-signal evidence contract)",
  "description": "The canonical scored-signal evidence record contract. This is the SINGLE canonical persisted shape of the one canonical scored-signal evidence store (MONGO-GOV D-MONGO-1), authored as an afi-config-governed schema (MONGO-GOV D-MONGO-2) under MONGO-IMPL Slot-1 (MONGO-CONTRACT). It is a THIN, self-identifying evidence record keyed by the governed signalId (OBJ-GOV D-OBJ-1) that CARRIES BY REUSE the canonical afi.scored-signal.v1 projection (OBJ-GOV D-OBJ-5) and its afi.provenance-record.v1 (present per LIFE-GOV D-LIFE-6; replay/verify sufficiency per MONGO-GOV D-MONGO-9), the canonical strategy identity triple (OBJ-GOV D-OBJ-3), explicit schema/object versions (OBJ-GOV D-OBJ-6), and the minimum lifecycle/finality fields (LIFE-GOV D-LIFE-1/D-LIFE-4/D-LIFE-6, MONGO-GOV D-MONGO-5). It is NOT the heavy ReactorScoredSignalDocument and NOT the full VaultedSignalRecord lifecycle brain: runtime/storage baggage (rawUss, lenses, _priceFeedMetadata, rawPayload, volatile processing timestamps) and validator/minted/replayed/training/proprietary lifecycle-brain fields are structurally rejected (additionalProperties:false, and the reused sub-schemas are themselves additionalProperties:false).",
  "$comment": "BOUNDARY (MONGO-IMPL Slot-1): schema/contract only — NO storage engine, NO collection names, NO indexes, NO deployment topology, NO migration mechanics, NO API/endpoint. Store-layer requirements that JSON Schema cannot enforce (signalId uniqueness, append-once, immutable-after-FINALIZED, single-writer boundary, operational-vs-canonical separation) are recorded as governed contract constraints in x-afiConstraints and enforced by the accompanying contract-constraint tests, NOT by index/DDL here. Cross-object identifier continuity (top-level signalId == scoredSignal.signalId == provenanceRecord.signalId; strategy-triple agreement) also cannot be enforced by JSON Schema draft-07 and is a governed contract constraint (x-afiConstraints) verified by the drift-guard tests.",
  "x-afiStatus": "governed-contract",
  "x-afiPartOf": "AFI Canonical Scored-Signal Evidence Persistence — MONGO-CONTRACT (Slot 1)",
  "x-afiDoctrineRefs": [
    "afi-governance/decisions/persistence-impl-v0.1.md (MONGO-IMPL) Slot 1 — authorizes this afi.scored-signal-evidence.v1 afi-config contract; boundary is schema/contract only",
    "afi-governance/decisions/persistence-v0.1.md (MONGO-GOV) D-MONGO-1 — one canonical scored-signal evidence store & its self-identifying persisted shape",
    "afi-governance/decisions/persistence-v0.1.md (MONGO-GOV) D-MONGO-2 — afi-config owns the canonical persisted-record schema contract",
    "afi-governance/decisions/persistence-v0.1.md (MONGO-GOV) D-MONGO-5 — write-once/append-only per signalId; immutable-after-FINALIZED; versioning by supersession",
    "afi-governance/decisions/persistence-v0.1.md (MONGO-GOV) D-MONGO-6 — signalId uniqueness/idempotency at the store layer",
    "afi-governance/decisions/persistence-v0.1.md (MONGO-GOV) D-MONGO-9 — replay/verify sufficiency data guarantees on the record",
    "afi-governance/decisions/object-identity-v0.1.md (OBJ-GOV) D-OBJ-1 — signalId canonical end-to-end join key",
    "afi-governance/decisions/object-identity-v0.1.md (OBJ-GOV) D-OBJ-3 — canonical strategy triple analystId + strategyId + strategyVersion",
    "afi-governance/decisions/object-identity-v0.1.md (OBJ-GOV) D-OBJ-5 — canonical Scored Signal representation = thin afi.scored-signal.v1 projection",
    "afi-governance/decisions/object-identity-v0.1.md (OBJ-GOV) D-OBJ-6 — two-axis versioning (schema-id const + distinct canonicalizationVersion)",
    "afi-governance/decisions/lifecycle-v0.1.md (LIFE-GOV) D-LIFE-1 — one canonical lifecycle state machine",
    "afi-governance/decisions/lifecycle-v0.1.md (LIFE-GOV) D-LIFE-4 — single finality writer; FINALIZED is a lifecycle-finality event (not settlement finality)",
    "afi-governance/decisions/lifecycle-v0.1.md (LIFE-GOV) D-LIFE-5 — identifier continuity: every lifecycle record keyed on signalId + carries the strategy triple + references afi.scored-signal.v1",
    "afi-governance/decisions/lifecycle-v0.1.md (LIFE-GOV) D-LIFE-6 — pre-persistence handoff: VALIDATED + SCORED (afi.scored-signal.v1 projection AND its ProvenanceRecord) + identifier continuity before entry into this store"
  ],
  "x-afiConstraints": {
    "storeUniqueness": "STORE-LAYER (not JSON-Schema-enforceable): the canonical evidence store MUST enforce signalId uniqueness on the single CURRENT canonical record per signalId (MONGO-GOV D-MONGO-6 — unique constraint / insert-if-absent). Re-ingesting the same signalId MUST NOT create a duplicate canonical record. The store type MUST support a unique signalId constraint (i.e. a standard collection, NOT time-series). This contract fixes signalId as the idempotency key; the index/DDL/collection is MONGO-STORE (Slot 2), not this schema.",
    "appendOnceImmutableAfterFinalized": "STORE-LAYER (not JSON-Schema-enforceable): the record is write-once/append-only per signalId (MONGO-GOV D-MONGO-5). One CURRENT record per signalId; a governed correction SUPERSEDES the current record with a new schema-versioned record (recordVersion increments; superseded versions retained immutably as history). Once lifecycleState reaches FINALIZED, the record is immutable (finalized === true marks this). Immutability here is STORAGE custody, NOT settlement finality (CHAIN-GOV).",
    "singleWriterBoundary": "STORE-LAYER (not JSON-Schema-enforceable): only the afi-infra canonical persistence interface may write this record (MONGO-GOV D-MONGO-3). Reactor and Gateway are SUBMITTERS, not writers. A record is admissible only when it carries the afi.scored-signal.v1 projection + provenance linkage + signalId continuity and satisfies the LIFE-GOV D-LIFE-6 handoff. This contract does not define that interface (ATLAS-GOV / MONGO-STORE), only the shape it transports.",
    "operationalVsCanonical": "This record is CANONICAL evidence only (MONGO-GOV D-MONGO-4). Raw/unscored ingestion, intermediate/DAG state, retry/dead-letter, replay inputs, dedupe caches, and telemetry are OPERATIONAL stores and MUST NOT be represented by this contract.",
    "identifierContinuity": "CROSS-OBJECT (not JSON-Schema-draft-07-enforceable): the top-level signalId MUST equal scoredSignal.signalId AND provenanceRecord.signalId (OBJ-GOV D-OBJ-1, LIFE-GOV D-LIFE-5). The top-level strategy triple (analystId, strategyId, strategyVersion) — all three REQUIRED-present on this evidence record — MUST equal the scoredSignal triple (OBJ-GOV D-OBJ-3). The top-level canonicalizationVersion MUST equal provenanceRecord.canonicalizationVersion (OBJ-GOV D-OBJ-6). Enforced by the drift-guard contract tests.",
    "replaySufficiency": "The record is structured for deterministic off-line replay/verify (MONGO-GOV D-MONGO-9): it carries the afi.scored-signal.v1 projection AND the afi.provenance-record.v1, which supplies AT MINIMUM the input + output CanonicalHash digests (required by that shape), plus the enrichment digest and replay pins where present (optional on the reused shape). Tightening replay-pin cardinality to a hard minimum is deferred WITH the full afi.provenance-record.v1 canonical shape (OBJ-GOV D-OBJ-6/D-OBJ-7; not re-decided here); this contract does not relax D-MONGO-9 but does not over-fix the deferred provenance shape. This is a data guarantee on the record — NOT a read/replay endpoint (ATLAS-GOV)."
  },
  "type": "object",
  "additionalProperties": false,
  "required": [
    "schema",
    "signalId",
    "analystId",
    "strategyId",
    "strategyVersion",
    "canonicalizationVersion",
    "lifecycleState",
    "finalized",
    "scoredSignal",
    "provenanceRecord"
  ],
  "properties": {
    "schema": {
      "type": "string",
      "const": "afi.scored-signal-evidence.v1",
      "description": "Schema-id version of the evidence record (OBJ-GOV D-OBJ-6 axis (a): per-object schema-id const afi.<object>.v<major>). Versions the RECORD shape, distinct from canonicalizationVersion."
    },
    "signalId": {
      "type": "string",
      "minLength": 1,
      "description": "The canonical join key (OBJ-GOV D-OBJ-1): stable, opaque, assigned once at the USS ingest boundary, threaded verbatim, immutable. This is the store idempotency key (MONGO-GOV D-MONGO-6). MUST equal scoredSignal.signalId and provenanceRecord.signalId (identifier continuity, LIFE-GOV D-LIFE-5)."
    },
    "analystId": {
      "type": "string",
      "minLength": 1,
      "description": "Canonical strategy triple member (OBJ-GOV D-OBJ-3): the analyst, kept orthogonal to strategyId, never folded into it. MUST equal scoredSignal.analystId."
    },
    "strategyId": {
      "type": "string",
      "minLength": 1,
      "description": "Canonical strategy triple member (OBJ-GOV D-OBJ-3): the strategy identifier (bare snake_case slug with embedded major-version token; must not embed the analyst name). MUST equal scoredSignal.strategyId. This contract fixes NO strategy value/format beyond OBJ-GOV D-OBJ-3; production scoring law is untouched."
    },
    "strategyVersion": {
      "type": "string",
      "minLength": 1,
      "description": "REQUIRED canonical strategy triple member (OBJ-GOV D-OBJ-3): finer semver-without-v-prefix version, separate from strategyId. The canonical evidence record MUST carry the COMPLETE canonical strategy identity triple (analystId + strategyId + strategyVersion), so this field is required on the evidence contract even though D-OBJ-3 leaves it optional at the general object-identity level and the reused afi.scored-signal.v1 projection keeps it optional. MUST equal scoredSignal.strategyVersion (identifier continuity). Format is unchanged from D-OBJ-3 (non-binding, illustrative semver e.g. 1.0.0); this is a presence requirement on the evidence record, not a redefinition of the governed format or of the projection's own optionality."
    },
    "canonicalizationVersion": {
      "type": "string",
      "pattern": "^afi\\.hash\\.v[0-9]+$",
      "description": "Two-axis versioning axis (b) (OBJ-GOV D-OBJ-6): the canonical-serialization rules version, held DISTINCT from the schema-id. MUST agree with provenanceRecord.canonicalizationVersion (enforced as a governed identifier-continuity constraint; see x-afiConstraints.identifierContinuity); the canonicalizationVersion inside each contained CanonicalHash is expected to match by the same doctrine. This field pins the version only; hash/serialization rules are District-2 / CHAIN-GOV doctrine, not set here."
    },
    "lifecycleState": {
      "type": "string",
      "description": "The canonical LIFE-GOV lifecycle state (D-LIFE-1) of this signal, as a lifecycle attribute of the evidence record (LIFE-GOV D-LIFE-5). Restricted to the PERSISTABLE states: a record only exists post-scoring (LIFE-GOV D-LIFE-6 handoff requires VALIDATED + SCORED), so pre-scoring states (INGESTED, VALIDATED, SCHEMA_REJECTED) are NOT admissible here. Shipped tier-4 vocabularies (afi-mint pending/minted, afi-infra RAW/ENRICHED/ANALYZED/SCORED-caps/MINTED/REPLAYED, decay_pass/challenge_open/voting_complete) are NOT this canonical set. Mint/settlement states are CHAIN-GOV, beyond EPOCH_ELIGIBLE, and not representable here.",
      "enum": [
        "SCORED",
        "CERTIFIED",
        "DECERTIFIED",
        "QUALIFIED",
        "UNQUALIFIED",
        "CHALLENGE_OPEN",
        "CONTESTED",
        "FINALIZED",
        "FINAL_REJECTED",
        "EPOCH_ELIGIBLE"
      ]
    },
    "finalized": {
      "type": "boolean",
      "description": "The immutable-after-FINALIZED marker (MONGO-GOV D-MONGO-5). MUST be true iff lifecycleState is a finalization-phase-or-later state (FINALIZED, FINAL_REJECTED, EPOCH_ELIGIBLE) — bound structurally by if/then/else below. Marks storage-custody immutability (append-once, supersede-only), NOT on-chain settlement finality (CHAIN-GOV). FINALIZED/FINAL_REJECTED are written only by the LIFE-GOV finality writer (D-LIFE-4); this contract records the marker, it does not name or wire that writer."
    },
    "scoredSignal": {
      "$ref": "https://afi-protocol.org/schemas/provenance/v1/scored-signal.schema.json",
      "description": "The canonical thin afi.scored-signal.v1 projection (OBJ-GOV D-OBJ-5), carried BY REUSE of the governed schema (not redefined). Its additionalProperties:false structurally forbids substituting the heavy ReactorScoredSignalDocument (rawUss/lenses/_priceFeedMetadata/rawPayload) for the thin projection."
    },
    "provenanceRecord": {
      "$ref": "https://afi-protocol.org/schemas/provenance/v1/provenance-record.schema.json",
      "description": "The afi.provenance-record.v1 required PRESENT by LIFE-GOV D-LIFE-6, carried BY REUSE of the governed schema. Supplies the input/enrichment/output CanonicalHash digests + replay pins for MONGO-GOV D-MONGO-9 replay/verify sufficiency. Its full canonical shape remains a deferred afi-config schema (OBJ-GOV D-OBJ-6 / D-OBJ-7 fix only its versioning/continuity-linkage role); this contract reuses the existing District-2 draft shape and does not re-decide it."
    },
    "recordVersion": {
      "type": "integer",
      "minimum": 1,
      "description": "OPTIONAL supersession counter for versioning-by-supersession (MONGO-GOV D-MONGO-5). The first canonical record for a signalId is version 1 (omission means 1); a governed correction supersedes with an incremented recordVersion and a new schema-versioned record. Never an in-place edit; never relaxes the one-current-record-per-signalId invariant."
    },
    "supersedesRecordHash": {
      "$ref": "https://afi-protocol.org/schemas/provenance/v1/canonical-hash.schema.json",
      "description": "OPTIONAL CanonicalHash link to the immediately-superseded canonical evidence record (MONGO-GOV D-MONGO-5 supersession chain). Present only when recordVersion > 1; the superseded record is retained immutably as history."
    }
  },
  "if": {
    "properties": {
      "lifecycleState": {
        "enum": ["FINALIZED", "FINAL_REJECTED", "EPOCH_ELIGIBLE"]
      }
    }
  },
  "then": {
    "properties": {
      "finalized": { "const": true }
    }
  },
  "else": {
    "properties": {
      "finalized": { "const": false }
    }
  }
}
